{
  "$schema": "https://json-schema.org/draft/2020-12/schema",
  "$id": "canvas_graph.v1.json",
  "title": "canvas_graph.v1",
  "type": "object",
  "required": ["schema_version", "graph_id", "name", "nodes", "edges", "exported_at"],
  "properties": {
    "schema_version": { "const": "canvas_graph.v1" },
    "graph_id": { "type": "string", "minLength": 1 },
    "name": { "type": "string" },
    "nodes": {
      "type": "array",
      "items": {
        "type": "object",
        "required": ["id", "type", "position", "data"],
        "properties": {
          "id": { "type": "string", "minLength": 1 },
          "type": { "type": "string", "minLength": 1 },
          "position": {
            "type": "object",
            "required": ["x", "y"],
            "properties": {
              "x": { "type": "number" },
              "y": { "type": "number" }
            },
            "additionalProperties": true
          },
          "data": { "type": "object" }
        },
        "additionalProperties": true
      }
    },
    "edges": {
      "type": "array",
      "items": {
        "type": "object",
        "required": ["id", "source", "target"],
        "properties": {
          "id": { "type": "string", "minLength": 1 },
          "source": { "type": "string", "minLength": 1 },
          "target": { "type": "string", "minLength": 1 },
          "sourceHandle": { "type": "string" },
          "targetHandle": { "type": "string" },
          "data": { "type": "object" }
        },
        "additionalProperties": true
      }
    },
    "viewport": { "type": "object" },
    "ui_state": { "type": "object" },
    "exported_at": { "type": "string", "format": "date-time" },
    "metadata": { "type": "object" }
  },
  "additionalProperties": false
}
